{
  "schema_version": "1.0.0",
  "product_class": "public-marketing-website",
  "checklist_ref": {
    "path": "baselines/public-marketing-website.json",
    "version": "0.1.0",
    "sha": ""
  },
  "items": [
    {
      "id": "DS-TOK-001",
      "type": "functional",
      "priority": 1,
      "title": "Dark-theme color token set as single source of truth",
      "source_ears_id": "DS-01",
      "dependencies": [],
      "acceptance_criteria": [
        "See docs/website/autonomous-agent.dev/requirements.md DS-01 for the full EARS statement and objective acceptance criteria."
      ],
      "in_scope": true,
      "status": "unproven",
      "ears_pattern": "ubiquitous"
    },
    {
      "id": "DS-TOK-002",
      "type": "functional",
      "priority": 1,
      "title": "WCAG 2.2 AA contrast guarantee for token pairings",
      "source_ears_id": "DS-02",
      "dependencies": [],
      "acceptance_criteria": [
        "See docs/website/autonomous-agent.dev/requirements.md DS-02 for the full EARS statement and objective acceptance criteria."
      ],
      "in_scope": true,
      "status": "unproven",
      "ears_pattern": "state-driven"
    },
    {
      "id": "DS-TOK-003",
      "type": "functional",
      "priority": 1,
      "title": "Typographic system, scale, and weights",
      "source_ears_id": "DS-03",
      "dependencies": [],
      "acceptance_criteria": [
        "See docs/website/autonomous-agent.dev/requirements.md DS-03 for the full EARS statement and objective acceptance criteria."
      ],
      "in_scope": true,
      "status": "unproven",
      "ears_pattern": "ubiquitous"
    },
    {
      "id": "DS-TOK-004",
      "type": "functional",
      "priority": 1,
      "title": "Self-hosted, swap-safe brand fonts",
      "source_ears_id": "DS-04",
      "dependencies": [],
      "acceptance_criteria": [
        "See docs/website/autonomous-agent.dev/requirements.md DS-04 for the full EARS statement and objective acceptance criteria."
      ],
      "in_scope": true,
      "status": "unproven",
      "ears_pattern": "event-driven"
    },
    {
      "id": "DS-TOK-005",
      "type": "functional",
      "priority": 1,
      "title": "Machine artifacts rendered in monospace only",
      "source_ears_id": "DS-05",
      "dependencies": [],
      "acceptance_criteria": [
        "See docs/website/autonomous-agent.dev/requirements.md DS-05 for the full EARS statement and objective acceptance criteria."
      ],
      "in_scope": true,
      "status": "unproven",
      "ears_pattern": "state-driven"
    },
    {
      "id": "DS-TOK-006",
      "type": "functional",
      "priority": 1,
      "title": "Accent reserved for verification states only",
      "source_ears_id": "DS-06",
      "dependencies": [],
      "acceptance_criteria": [
        "See docs/website/autonomous-agent.dev/requirements.md DS-06 for the full EARS statement and objective acceptance criteria."
      ],
      "in_scope": true,
      "status": "unproven",
      "ears_pattern": "state-driven"
    },
    {
      "id": "DS-TOK-007",
      "type": "functional",
      "priority": 1,
      "title": "Layout tokens (spacing, radius, elevation, container)",
      "source_ears_id": "DS-07",
      "dependencies": [],
      "acceptance_criteria": [
        "See docs/website/autonomous-agent.dev/requirements.md DS-07 for the full EARS statement and objective acceptance criteria."
      ],
      "in_scope": true,
      "status": "unproven",
      "ears_pattern": "ubiquitous"
    },
    {
      "id": "DS-TOK-008",
      "type": "functional",
      "priority": 1,
      "title": "Motion registry: every animation maps to a real state",
      "source_ears_id": "DS-08",
      "dependencies": [],
      "acceptance_criteria": [
        "See docs/website/autonomous-agent.dev/requirements.md DS-08 for the full EARS statement and objective acceptance criteria."
      ],
      "in_scope": true,
      "status": "unproven",
      "ears_pattern": "unwanted"
    },
    {
      "id": "DS-TOK-009",
      "type": "functional",
      "priority": 1,
      "title": "Reduced-motion state-preserving fallbacks",
      "source_ears_id": "DS-09",
      "dependencies": [],
      "acceptance_criteria": [
        "See docs/website/autonomous-agent.dev/requirements.md DS-09 for the full EARS statement and objective acceptance criteria."
      ],
      "in_scope": true,
      "status": "unproven",
      "ears_pattern": "event-driven"
    },
    {
      "id": "DS-TOK-010",
      "type": "functional",
      "priority": 1,
      "title": "Single token source builds deterministically",
      "source_ears_id": "DS-10",
      "dependencies": [],
      "acceptance_criteria": [
        "See docs/website/autonomous-agent.dev/requirements.md DS-10 for the full EARS statement and objective acceptance criteria."
      ],
      "in_scope": true,
      "status": "unproven",
      "ears_pattern": "unwanted"
    },
    {
      "id": "DS-TOK-011",
      "type": "functional",
      "priority": 1,
      "title": "Token-driven component primitive library",
      "source_ears_id": "DS-11",
      "dependencies": [],
      "acceptance_criteria": [
        "See docs/website/autonomous-agent.dev/requirements.md DS-11 for the full EARS statement and objective acceptance criteria."
      ],
      "in_scope": true,
      "status": "unproven",
      "ears_pattern": "ubiquitous"
    },
    {
      "id": "DS-TOK-012",
      "type": "functional",
      "priority": 1,
      "title": "Code/trace/evidence block primitive",
      "source_ears_id": "DS-12",
      "dependencies": [],
      "acceptance_criteria": [
        "See docs/website/autonomous-agent.dev/requirements.md DS-12 for the full EARS statement and objective acceptance criteria."
      ],
      "in_scope": true,
      "status": "unproven",
      "ears_pattern": "event-driven"
    },
    {
      "id": "DS-TOK-013",
      "type": "functional",
      "priority": 1,
      "title": "Accessibility: keyboard, focus, non-color state, semantics",
      "source_ears_id": "DS-13",
      "dependencies": [],
      "acceptance_criteria": [
        "See docs/website/autonomous-agent.dev/requirements.md DS-13 for the full EARS statement and objective acceptance criteria."
      ],
      "in_scope": true,
      "status": "unproven",
      "ears_pattern": "ubiquitous"
    },
    {
      "id": "DS-TOK-014",
      "type": "functional",
      "priority": 2,
      "title": "Wordmark, logo usage, and line-icon set",
      "source_ears_id": "DS-14",
      "dependencies": [],
      "acceptance_criteria": [
        "See docs/website/autonomous-agent.dev/requirements.md DS-14 for the full EARS statement and objective acceptance criteria."
      ],
      "in_scope": true,
      "status": "unproven",
      "ears_pattern": "unwanted"
    },
    {
      "id": "DS-TOK-015",
      "type": "functional",
      "priority": 2,
      "title": "Performance budgets and CWV protection",
      "source_ears_id": "DS-15",
      "dependencies": [],
      "acceptance_criteria": [
        "See docs/website/autonomous-agent.dev/requirements.md DS-15 for the full EARS statement and objective acceptance criteria."
      ],
      "in_scope": true,
      "status": "unproven",
      "ears_pattern": "state-driven"
    },
    {
      "id": "DS-TOK-016",
      "type": "functional",
      "priority": 1,
      "title": "No quantified verification claims until verifiable",
      "source_ears_id": "DS-16",
      "dependencies": [],
      "acceptance_criteria": [
        "See docs/website/autonomous-agent.dev/requirements.md DS-16 for the full EARS statement and objective acceptance criteria."
      ],
      "in_scope": true,
      "status": "unproven",
      "ears_pattern": "unwanted"
    },
    {
      "id": "DS-TOK-017",
      "type": "functional",
      "priority": 2,
      "title": "Calm loading, empty, and asset-fallback states",
      "source_ears_id": "DS-17",
      "dependencies": [],
      "acceptance_criteria": [
        "See docs/website/autonomous-agent.dev/requirements.md DS-17 for the full EARS statement and objective acceptance criteria."
      ],
      "in_scope": true,
      "status": "unproven",
      "ears_pattern": "state-driven"
    },
    {
      "id": "DS-TOK-018",
      "type": "functional",
      "priority": 2,
      "title": "Responsive system with no horizontal overflow",
      "source_ears_id": "DS-18",
      "dependencies": [],
      "acceptance_criteria": [
        "See docs/website/autonomous-agent.dev/requirements.md DS-18 for the full EARS statement and objective acceptance criteria."
      ],
      "in_scope": true,
      "status": "unproven",
      "ears_pattern": "state-driven"
    },
    {
      "id": "DS-TOK-019",
      "type": "functional",
      "priority": 1,
      "title": "Complete icon/manifest bundle with no white-flash",
      "source_ears_id": "DS-19",
      "dependencies": [],
      "acceptance_criteria": [
        "See docs/website/autonomous-agent.dev/requirements.md DS-19 for the full EARS statement and objective acceptance criteria."
      ],
      "in_scope": true,
      "status": "unproven",
      "ears_pattern": "ubiquitous"
    },
    {
      "id": "IA-NAV-001",
      "type": "functional",
      "priority": 1,
      "title": "Canonical content routes resolve",
      "source_ears_id": "IA-01",
      "dependencies": [],
      "acceptance_criteria": [
        "See docs/website/autonomous-agent.dev/requirements.md IA-01 for the full EARS statement and objective acceptance criteria."
      ],
      "in_scope": true,
      "status": "unproven",
      "ears_pattern": "ubiquitous"
    },
    {
      "id": "IA-NAV-002",
      "type": "functional",
      "priority": 1,
      "title": "Single canonical URL form",
      "source_ears_id": "IA-02",
      "dependencies": [],
      "acceptance_criteria": [
        "See docs/website/autonomous-agent.dev/requirements.md IA-02 for the full EARS statement and objective acceptance criteria."
      ],